[
  {
    "question_id": "MA-FUNC-001",
    "occurrence_id": "MA-FIXTURE-001",
    "revision_id": "r1",
    "subject": "math",
    "source": {
      "source_id": "fixture-math-structure",
      "title": "自拟数学公式结构压力样本",
      "year": "fixture",
      "provider": "single-admission-workbook",
      "format": "self_authored"
    },
    "source_type": "self_authored",
    "verification_status": "reviewed",
    "allowed_usage": "student_release",
    "topic": ["functions", "algebra"],
    "difficulty": "introductory",
    "stem": {
      "text": "若函数 f(x)=x^2-2x+1，则 f(2) 的值为（　　）。",
      "segments": [
        {"kind": "text", "text": "若函数 "},
        {"kind": "math", "text": "f(x)=x^2-2x+1"},
        {"kind": "text", "text": "，则 "},
        {"kind": "math", "text": "f(2)"},
        {"kind": "text", "text": " 的值为（　　）。"}
      ]
    },
    "choices": [
      {"label": "A", "text": "0"},
      {"label": "B", "text": "1"},
      {"label": "C", "text": "2"},
      {"label": "D", "text": "3"}
    ],
    "score": {"points": 5, "kind": "objective"},
    "answer": {
      "value": "B",
      "basis": "代入 x=2，得到 4-4+1=1。",
      "scoring_points": ["正确代入", "结果为 1"]
    },
    "explanation": "通过公式片段检查上下标、运算符和中英文数学混排。",
    "notes": "自拟结构样本，不是历年真题。"
  },
  {
    "question_id": "MA-PROB-001",
    "occurrence_id": "MA-FIXTURE-002",
    "revision_id": "r1",
    "subject": "math",
    "source": {
      "source_id": "fixture-math-structure",
      "title": "自拟数学公式结构压力样本",
      "year": "fixture",
      "provider": "single-admission-workbook",
      "format": "self_authored"
    },
    "source_type": "self_authored",
    "verification_status": "reviewed",
    "allowed_usage": "student_release",
    "topic": ["counting_and_probability"],
    "difficulty": "standard",
    "stem": {
      "text": "从 1，2，3 中任取一个数，取到偶数的概率是多少？",
      "segments": [
        {"kind": "text", "text": "从 "},
        {"kind": "math", "text": "1,2,3"},
        {"kind": "text", "text": " 中任取一个数，取到偶数的概率是多少？"}
      ]
    },
    "score": {"points": 10, "kind": "solution"},
    "answer": {
      "value": "1/3",
      "basis": "样本空间有 3 个等可能结果，偶数只有 2，因此概率为 1/3。",
      "scoring_points": ["列出等可能结果", "识别偶数结果", "写出概率"]
    },
    "explanation": "解答题保留得分点，避免只输出一个没有过程的结果。",
    "notes": "自拟结构样本，不是历年真题。"
  }
]
