[
  {
    "question_id": "PO-POLICY-001",
    "occurrence_id": "PO-FIXTURE-001",
    "revision_id": "r1",
    "subject": "politics",
    "source": {
      "source_id": "fixture-politics-structure",
      "title": "自拟政治材料题结构压力样本",
      "year": "fixture",
      "provider": "single-admission-workbook",
      "format": "self_authored"
    },
    "source_type": "self_authored",
    "verification_status": "reviewed",
    "allowed_usage": "student_release",
    "topic": ["economy_and_society", "evidence_and_argument"],
    "difficulty": "standard",
    "stem": {
      "text": "结合材料，说明把学习成果转化为行动时应坚持的两个原则。",
      "segments": [
        {"kind": "text", "text": "结合材料，说明把学习成果转化为行动时应坚持的两个原则。"}
      ]
    },
    "material": {
      "id": "PO-MAT-001",
      "text": "材料：某训练队把每周复盘结果分解成小任务，先验证关键环节，再根据反馈调整计划；队员可以查看依据，也可以提出不同意见。"
    },
    "score": {"points": 10, "kind": "solution", "observed_text": "材料题示例分值，非官方试卷分值"},
    "answer": {
      "value": "坚持从实际出发；坚持实践、反馈与改进相结合。",
      "basis": "材料同时体现任务分解、验证反馈和意见修正。",
      "scoring_points": ["联系实际", "重视实践检验", "根据反馈改进"]
    },
    "explanation": "政治材料题答案必须拆成可评分要点，并保留材料对应关系。",
    "temporal": {
      "valid_from": "fixture",
      "valid_to": "fixture",
      "current_affairs_window": "not_applicable_self_authored_fixture"
    },
    "notes": "自拟结构样本，不是历年真题，不含时事判断。"
  }
]
